{
  "schemaVersion": 1,
  "id": "alle-meine-entchen",
  "title": "Alle meine Entchen (All My Little Ducklings)",
  "artist": "Traditional (German)",
  "source": {
    "name": "Wikipedia (de) – Alle meine Entchen, LilyPond score",
    "url": "https://de.wikipedia.org/wiki/Alle_meine_Entchen"
  },
  "license": "public-domain",
  "attribution": "Traditional German children's song. Public domain. Arrangement: Tongue Drum Song Finder.",
  "difficulty": "easy",
  "tags": [
    "kids",
    "folk",
    "german"
  ],
  "tempo": 100,
  "timeSignature": "4/4",
  "arrangements": {
    "C": {
      "minLayout": "8",
      "lines": [
        {
          "lyric": "Alle meine Entchen",
          "notes": [
            {
              "deg": 1,
              "oct": 0,
              "dur": 0.5
            },
            {
              "deg": 2,
              "oct": 0,
              "dur": 0.5
            },
            {
              "deg": 3,
              "oct": 0,
              "dur": 0.5
            },
            {
              "deg": 4,
              "oct": 0,
              "dur": 0.5
            },
            {
              "deg": 5,
              "oct": 0,
              "dur": 1
            },
            {
              "deg": 5,
              "oct": 0,
              "dur": 1
            }
          ]
        },
        {
          "lyric": "schwimmen auf dem See,",
          "notes": [
            {
              "deg": 6,
              "oct": 0,
              "dur": 0.5
            },
            {
              "deg": 6,
              "oct": 0,
              "dur": 0.5
            },
            {
              "deg": 6,
              "oct": 0,
              "dur": 0.5
            },
            {
              "deg": 6,
              "oct": 0,
              "dur": 0.5
            },
            {
              "deg": 5,
              "oct": 0,
              "dur": 2
            }
          ]
        },
        {
          "lyric": "schwimmen auf dem See,",
          "notes": [
            {
              "deg": 6,
              "oct": 0,
              "dur": 0.5
            },
            {
              "deg": 6,
              "oct": 0,
              "dur": 0.5
            },
            {
              "deg": 6,
              "oct": 0,
              "dur": 0.5
            },
            {
              "deg": 6,
              "oct": 0,
              "dur": 0.5
            },
            {
              "deg": 5,
              "oct": 0,
              "dur": 2
            }
          ]
        },
        {
          "lyric": "Köpfchen in das Wasser,",
          "notes": [
            {
              "deg": 4,
              "oct": 0,
              "dur": 0.5
            },
            {
              "deg": 4,
              "oct": 0,
              "dur": 0.5
            },
            {
              "deg": 4,
              "oct": 0,
              "dur": 0.5
            },
            {
              "deg": 4,
              "oct": 0,
              "dur": 0.5
            },
            {
              "deg": 3,
              "oct": 0,
              "dur": 1
            },
            {
              "deg": 3,
              "oct": 0,
              "dur": 1
            }
          ]
        },
        {
          "lyric": "Schwänzchen in die Höh'.",
          "notes": [
            {
              "deg": 2,
              "oct": 0,
              "dur": 0.5
            },
            {
              "deg": 2,
              "oct": 0,
              "dur": 0.5
            },
            {
              "deg": 2,
              "oct": 0,
              "dur": 0.5
            },
            {
              "deg": 2,
              "oct": 0,
              "dur": 0.5
            },
            {
              "deg": 1,
              "oct": 0,
              "dur": 2
            }
          ]
        }
      ]
    },
    "D": {
      "minLayout": "8",
      "lines": [
        {
          "lyric": "Alle meine Entchen",
          "notes": [
            {
              "deg": 1,
              "oct": 0,
              "dur": 0.5
            },
            {
              "deg": 2,
              "oct": 0,
              "dur": 0.5
            },
            {
              "deg": 3,
              "oct": 0,
              "dur": 0.5
            },
            {
              "deg": 4,
              "oct": 0,
              "dur": 0.5
            },
            {
              "deg": 5,
              "oct": 0,
              "dur": 1
            },
            {
              "deg": 5,
              "oct": 0,
              "dur": 1
            }
          ]
        },
        {
          "lyric": "schwimmen auf dem See,",
          "notes": [
            {
              "deg": 6,
              "oct": 0,
              "dur": 0.5
            },
            {
              "deg": 6,
              "oct": 0,
              "dur": 0.5
            },
            {
              "deg": 6,
              "oct": 0,
              "dur": 0.5
            },
            {
              "deg": 6,
              "oct": 0,
              "dur": 0.5
            },
            {
              "deg": 5,
              "oct": 0,
              "dur": 2
            }
          ]
        },
        {
          "lyric": "schwimmen auf dem See,",
          "notes": [
            {
              "deg": 6,
              "oct": 0,
              "dur": 0.5
            },
            {
              "deg": 6,
              "oct": 0,
              "dur": 0.5
            },
            {
              "deg": 6,
              "oct": 0,
              "dur": 0.5
            },
            {
              "deg": 6,
              "oct": 0,
              "dur": 0.5
            },
            {
              "deg": 5,
              "oct": 0,
              "dur": 2
            }
          ]
        },
        {
          "lyric": "Köpfchen in das Wasser,",
          "notes": [
            {
              "deg": 4,
              "oct": 0,
              "dur": 0.5
            },
            {
              "deg": 4,
              "oct": 0,
              "dur": 0.5
            },
            {
              "deg": 4,
              "oct": 0,
              "dur": 0.5
            },
            {
              "deg": 4,
              "oct": 0,
              "dur": 0.5
            },
            {
              "deg": 3,
              "oct": 0,
              "dur": 1
            },
            {
              "deg": 3,
              "oct": 0,
              "dur": 1
            }
          ]
        },
        {
          "lyric": "Schwänzchen in die Höh'.",
          "notes": [
            {
              "deg": 2,
              "oct": 0,
              "dur": 0.5
            },
            {
              "deg": 2,
              "oct": 0,
              "dur": 0.5
            },
            {
              "deg": 2,
              "oct": 0,
              "dur": 0.5
            },
            {
              "deg": 2,
              "oct": 0,
              "dur": 0.5
            },
            {
              "deg": 1,
              "oct": 0,
              "dur": 2
            }
          ]
        }
      ]
    }
  },
  "arrangerNotes": "Verified against the LilyPond score on German Wikipedia. No simplification needed. Range 1 to 6. C and D arrangements use identical degree sequences (both fit their drums).",
  "verified": true
}
