{
  "schemaVersion": 1,
  "id": "eine-kleine-nachtmusik",
  "title": "Eine kleine Nachtmusik (first theme)",
  "artist": "Wolfgang Amadeus Mozart",
  "source": {
    "name": "Wikipedia (en) – Eine kleine Nachtmusik, LilyPond score of the first theme",
    "url": "https://en.wikipedia.org/wiki/Eine_kleine_Nachtmusik"
  },
  "license": "public-domain",
  "attribution": "Wolfgang Amadeus Mozart, Serenade No. 13 in G major, K. 525, 1st movement (1787). Public domain. Arrangement: Tongue Drum Song Finder.",
  "difficulty": "easy",
  "tags": [
    "classical"
  ],
  "tempo": 120,
  "timeSignature": "4/4",
  "arrangements": {
    "C": {
      "minLayout": "11",
      "lines": [
        {
          "notes": [
            {
              "deg": 1,
              "oct": 0,
              "dur": 1
            },
            {
              "rest": true,
              "dur": 0.5
            },
            {
              "deg": 5,
              "oct": -1,
              "dur": 0.5
            },
            {
              "deg": 1,
              "oct": 0,
              "dur": 1
            },
            {
              "rest": true,
              "dur": 0.5
            },
            {
              "deg": 5,
              "oct": -1,
              "dur": 0.5
            },
            {
              "deg": 1,
              "oct": 0,
              "dur": 0.5
            },
            {
              "deg": 5,
              "oct": -1,
              "dur": 0.5
            },
            {
              "deg": 1,
              "oct": 0,
              "dur": 0.5
            },
            {
              "deg": 3,
              "oct": 0,
              "dur": 0.5
            },
            {
              "deg": 5,
              "oct": 0,
              "dur": 1
            },
            {
              "rest": true,
              "dur": 1
            }
          ]
        },
        {
          "notes": [
            {
              "deg": 4,
              "oct": 0,
              "dur": 1
            },
            {
              "rest": true,
              "dur": 0.5
            },
            {
              "deg": 2,
              "oct": 0,
              "dur": 0.5
            },
            {
              "deg": 4,
              "oct": 0,
              "dur": 1
            },
            {
              "rest": true,
              "dur": 0.5
            },
            {
              "deg": 2,
              "oct": 0,
              "dur": 0.5
            },
            {
              "deg": 4,
              "oct": 0,
              "dur": 0.5
            },
            {
              "deg": 2,
              "oct": 0,
              "dur": 0.5
            },
            {
              "deg": 7,
              "oct": -1,
              "dur": 0.5
            },
            {
              "deg": 2,
              "oct": 0,
              "dur": 0.5
            },
            {
              "deg": 5,
              "oct": -1,
              "dur": 1
            }
          ]
        }
      ]
    },
    "D": {
      "minLayout": "11",
      "lines": [
        {
          "notes": [
            {
              "deg": 1,
              "oct": 0,
              "dur": 1
            },
            {
              "rest": true,
              "dur": 0.5
            },
            {
              "deg": 5,
              "oct": -1,
              "dur": 0.5
            },
            {
              "deg": 1,
              "oct": 0,
              "dur": 1
            },
            {
              "rest": true,
              "dur": 0.5
            },
            {
              "deg": 5,
              "oct": -1,
              "dur": 0.5
            },
            {
              "deg": 1,
              "oct": 0,
              "dur": 0.5
            },
            {
              "deg": 5,
              "oct": -1,
              "dur": 0.5
            },
            {
              "deg": 1,
              "oct": 0,
              "dur": 0.5
            },
            {
              "deg": 3,
              "oct": 0,
              "dur": 0.5
            },
            {
              "deg": 5,
              "oct": 0,
              "dur": 1
            },
            {
              "rest": true,
              "dur": 1
            }
          ]
        },
        {
          "notes": [
            {
              "deg": 4,
              "oct": 0,
              "dur": 1
            },
            {
              "rest": true,
              "dur": 0.5
            },
            {
              "deg": 2,
              "oct": 0,
              "dur": 0.5
            },
            {
              "deg": 4,
              "oct": 0,
              "dur": 1
            },
            {
              "rest": true,
              "dur": 0.5
            },
            {
              "deg": 2,
              "oct": 0,
              "dur": 0.5
            },
            {
              "deg": 4,
              "oct": 0,
              "dur": 0.5
            },
            {
              "deg": 2,
              "oct": 0,
              "dur": 0.5
            },
            {
              "deg": 7,
              "oct": -1,
              "dur": 0.5
            },
            {
              "deg": 2,
              "oct": 0,
              "dur": 0.5
            },
            {
              "deg": 5,
              "oct": -1,
              "dur": 1
            }
          ]
        }
      ]
    }
  },
  "arrangerNotes": "The famous opening theme (4 bars), verified against the LilyPond score on English Wikipedia; played one octave lower than written (Mozart's violins start on G5). The score's rests are kept, except the final one. No simplification needed. Range low 5 to 5. C and D arrangements use identical degree sequences (both fit their drums).",
  "verified": true
}
