{
  "schemaVersion": 1,
  "id": "go-round-and-round-the-valley",
  "title": "Go Round and Round the Valley",
  "artist": "Traditional (English)",
  "source": {
    "name": "Wikisource – Singing Games (children's game-song collection), page 17, LilyPond score",
    "url": "https://en.wikisource.org/wiki/Page%3ASinging_games.djvu/17"
  },
  "license": "public-domain",
  "attribution": "Traditional English singing game. Public domain. Arrangement: Tongue Drum Song Finder.",
  "difficulty": "easy",
  "tags": [
    "kids",
    "folk",
    "singing-game"
  ],
  "tempo": 108,
  "timeSignature": "4/4",
  "arrangements": {
    "C": {
      "minLayout": "11",
      "lines": [
        {
          "lyric": "Go round and round the valley,",
          "notes": [
            {
              "deg": 1,
              "oct": 0,
              "dur": 1
            },
            {
              "deg": 5,
              "oct": -1,
              "dur": 1
            },
            {
              "deg": 1,
              "oct": 0,
              "dur": 1
            },
            {
              "deg": 3,
              "oct": 0,
              "dur": 1.5
            },
            {
              "deg": 4,
              "oct": 0,
              "dur": 0.5
            },
            {
              "deg": 3,
              "oct": 0,
              "dur": 1
            },
            {
              "deg": 2,
              "oct": 0,
              "dur": 1
            },
            {
              "rest": true,
              "dur": 1
            }
          ]
        },
        {
          "lyric": "go round and round the valley,",
          "notes": [
            {
              "deg": 2,
              "oct": 0,
              "dur": 1
            },
            {
              "deg": 5,
              "oct": -1,
              "dur": 1
            },
            {
              "deg": 7,
              "oct": -1,
              "dur": 1
            },
            {
              "deg": 2,
              "oct": 0,
              "dur": 1.5
            },
            {
              "deg": 4,
              "oct": 0,
              "dur": 0.5
            },
            {
              "deg": 3,
              "oct": 0,
              "dur": 1
            },
            {
              "deg": 1,
              "oct": 0,
              "dur": 1
            },
            {
              "rest": true,
              "dur": 1
            }
          ]
        },
        {
          "lyric": "go round and round the valley,",
          "notes": [
            {
              "deg": 1,
              "oct": 0,
              "dur": 1
            },
            {
              "deg": 5,
              "oct": -1,
              "dur": 1
            },
            {
              "deg": 1,
              "oct": 0,
              "dur": 1
            },
            {
              "deg": 3,
              "oct": 0,
              "dur": 1.5
            },
            {
              "deg": 4,
              "oct": 0,
              "dur": 0.5
            },
            {
              "deg": 3,
              "oct": 0,
              "dur": 1
            },
            {
              "deg": 2,
              "oct": 0,
              "dur": 1
            },
            {
              "rest": true,
              "dur": 1
            },
            {
              "rest": true,
              "dur": 0.5
            }
          ]
        },
        {
          "lyric": "as we are all so gay.",
          "notes": [
            {
              "deg": 2,
              "oct": 0,
              "dur": 0.5
            },
            {
              "deg": 5,
              "oct": 0,
              "dur": 1
            },
            {
              "deg": 5,
              "oct": 0,
              "dur": 1
            },
            {
              "deg": 4,
              "oct": 0,
              "dur": 1
            },
            {
              "deg": 2,
              "oct": 0,
              "dur": 1
            },
            {
              "deg": 1,
              "oct": 0,
              "dur": 3
            }
          ]
        }
      ]
    },
    "D": {
      "minLayout": "11",
      "lines": [
        {
          "lyric": "Go round and round the valley,",
          "notes": [
            {
              "deg": 1,
              "oct": 0,
              "dur": 1
            },
            {
              "deg": 5,
              "oct": -1,
              "dur": 1
            },
            {
              "deg": 1,
              "oct": 0,
              "dur": 1
            },
            {
              "deg": 3,
              "oct": 0,
              "dur": 1.5
            },
            {
              "deg": 4,
              "oct": 0,
              "dur": 0.5
            },
            {
              "deg": 3,
              "oct": 0,
              "dur": 1
            },
            {
              "deg": 2,
              "oct": 0,
              "dur": 1
            },
            {
              "rest": true,
              "dur": 1
            }
          ]
        },
        {
          "lyric": "go round and round the valley,",
          "notes": [
            {
              "deg": 2,
              "oct": 0,
              "dur": 1
            },
            {
              "deg": 5,
              "oct": -1,
              "dur": 1
            },
            {
              "deg": 7,
              "oct": -1,
              "dur": 1
            },
            {
              "deg": 2,
              "oct": 0,
              "dur": 1.5
            },
            {
              "deg": 4,
              "oct": 0,
              "dur": 0.5
            },
            {
              "deg": 3,
              "oct": 0,
              "dur": 1
            },
            {
              "deg": 1,
              "oct": 0,
              "dur": 1
            },
            {
              "rest": true,
              "dur": 1
            }
          ]
        },
        {
          "lyric": "go round and round the valley,",
          "notes": [
            {
              "deg": 1,
              "oct": 0,
              "dur": 1
            },
            {
              "deg": 5,
              "oct": -1,
              "dur": 1
            },
            {
              "deg": 1,
              "oct": 0,
              "dur": 1
            },
            {
              "deg": 3,
              "oct": 0,
              "dur": 1.5
            },
            {
              "deg": 4,
              "oct": 0,
              "dur": 0.5
            },
            {
              "deg": 3,
              "oct": 0,
              "dur": 1
            },
            {
              "deg": 2,
              "oct": 0,
              "dur": 1
            },
            {
              "rest": true,
              "dur": 1
            },
            {
              "rest": true,
              "dur": 0.5
            }
          ]
        },
        {
          "lyric": "as we are all so gay.",
          "notes": [
            {
              "deg": 2,
              "oct": 0,
              "dur": 0.5
            },
            {
              "deg": 5,
              "oct": 0,
              "dur": 1
            },
            {
              "deg": 5,
              "oct": 0,
              "dur": 1
            },
            {
              "deg": 4,
              "oct": 0,
              "dur": 1
            },
            {
              "deg": 2,
              "oct": 0,
              "dur": 1
            },
            {
              "deg": 1,
              "oct": 0,
              "dur": 3
            }
          ]
        }
      ]
    }
  },
  "arrangerNotes": "Verified against the LilyPond score on the Wikisource transcription of the 'Singing Games' book (words as in the score); the score's rests are kept. No simplification needed. Range low 5 to 5. C and D arrangements use identical degree sequences (both fit their drums).",
  "verified": true
}
