{
  "schemaVersion": 1,
  "id": "frere-jacques",
  "title": "Frère Jacques (Are You Sleeping?)",
  "artist": "Traditional",
  "source": {
    "name": "Wikipedia – Frère Jacques, LilyPond score of the round (French traditional, 18th c.)",
    "url": "https://en.wikipedia.org/wiki/Fr%C3%A8re_Jacques"
  },
  "license": "public-domain",
  "attribution": "Melody and lyrics: traditional French (18th century). Public domain. Arrangement: Tongue Drum Song Finder.",
  "difficulty": "easy",
  "tags": [
    "kids",
    "round"
  ],
  "tempo": 100,
  "timeSignature": "4/4",
  "arrangements": {
    "C": {
      "minLayout": "11",
      "lines": [
        {
          "lyric": "Are you sleeping, are you sleeping,",
          "notes": [
            {
              "deg": 1,
              "oct": 0,
              "dur": 1
            },
            {
              "deg": 2,
              "oct": 0,
              "dur": 1
            },
            {
              "deg": 3,
              "oct": 0,
              "dur": 1
            },
            {
              "deg": 1,
              "oct": 0,
              "dur": 1
            },
            {
              "deg": 1,
              "oct": 0,
              "dur": 1
            },
            {
              "deg": 2,
              "oct": 0,
              "dur": 1
            },
            {
              "deg": 3,
              "oct": 0,
              "dur": 1
            },
            {
              "deg": 1,
              "oct": 0,
              "dur": 1
            }
          ]
        },
        {
          "lyric": "Brother John, Brother John?",
          "notes": [
            {
              "deg": 3,
              "oct": 0,
              "dur": 1
            },
            {
              "deg": 4,
              "oct": 0,
              "dur": 1
            },
            {
              "deg": 5,
              "oct": 0,
              "dur": 2
            },
            {
              "deg": 3,
              "oct": 0,
              "dur": 1
            },
            {
              "deg": 4,
              "oct": 0,
              "dur": 1
            },
            {
              "deg": 5,
              "oct": 0,
              "dur": 2
            }
          ]
        },
        {
          "lyric": "Morning bells are ringing, morning bells are ringing,",
          "notes": [
            {
              "deg": 5,
              "oct": 0,
              "dur": 0.5
            },
            {
              "deg": 6,
              "oct": 0,
              "dur": 0.5
            },
            {
              "deg": 5,
              "oct": 0,
              "dur": 0.5
            },
            {
              "deg": 4,
              "oct": 0,
              "dur": 0.5
            },
            {
              "deg": 3,
              "oct": 0,
              "dur": 1
            },
            {
              "deg": 1,
              "oct": 0,
              "dur": 1
            },
            {
              "deg": 5,
              "oct": 0,
              "dur": 0.5
            },
            {
              "deg": 6,
              "oct": 0,
              "dur": 0.5
            },
            {
              "deg": 5,
              "oct": 0,
              "dur": 0.5
            },
            {
              "deg": 4,
              "oct": 0,
              "dur": 0.5
            },
            {
              "deg": 3,
              "oct": 0,
              "dur": 1
            },
            {
              "deg": 1,
              "oct": 0,
              "dur": 1
            }
          ]
        },
        {
          "lyric": "ding, dang, dong; ding, dang, dong.",
          "notes": [
            {
              "deg": 1,
              "oct": 0,
              "dur": 1
            },
            {
              "deg": 5,
              "oct": -1,
              "dur": 1
            },
            {
              "deg": 1,
              "oct": 0,
              "dur": 2
            },
            {
              "deg": 1,
              "oct": 0,
              "dur": 1
            },
            {
              "deg": 5,
              "oct": -1,
              "dur": 1
            },
            {
              "deg": 1,
              "oct": 0,
              "dur": 2
            }
          ]
        }
      ]
    },
    "D": {
      "minLayout": "11",
      "lines": [
        {
          "lyric": "Are you sleeping, are you sleeping,",
          "notes": [
            {
              "deg": 1,
              "oct": 0,
              "dur": 1
            },
            {
              "deg": 2,
              "oct": 0,
              "dur": 1
            },
            {
              "deg": 3,
              "oct": 0,
              "dur": 1
            },
            {
              "deg": 1,
              "oct": 0,
              "dur": 1
            },
            {
              "deg": 1,
              "oct": 0,
              "dur": 1
            },
            {
              "deg": 2,
              "oct": 0,
              "dur": 1
            },
            {
              "deg": 3,
              "oct": 0,
              "dur": 1
            },
            {
              "deg": 1,
              "oct": 0,
              "dur": 1
            }
          ]
        },
        {
          "lyric": "Brother John, Brother John?",
          "notes": [
            {
              "deg": 3,
              "oct": 0,
              "dur": 1
            },
            {
              "deg": 4,
              "oct": 0,
              "dur": 1
            },
            {
              "deg": 5,
              "oct": 0,
              "dur": 2
            },
            {
              "deg": 3,
              "oct": 0,
              "dur": 1
            },
            {
              "deg": 4,
              "oct": 0,
              "dur": 1
            },
            {
              "deg": 5,
              "oct": 0,
              "dur": 2
            }
          ]
        },
        {
          "lyric": "Morning bells are ringing, morning bells are ringing,",
          "notes": [
            {
              "deg": 5,
              "oct": 0,
              "dur": 0.5
            },
            {
              "deg": 6,
              "oct": 0,
              "dur": 0.5
            },
            {
              "deg": 5,
              "oct": 0,
              "dur": 0.5
            },
            {
              "deg": 4,
              "oct": 0,
              "dur": 0.5
            },
            {
              "deg": 3,
              "oct": 0,
              "dur": 1
            },
            {
              "deg": 1,
              "oct": 0,
              "dur": 1
            },
            {
              "deg": 5,
              "oct": 0,
              "dur": 0.5
            },
            {
              "deg": 6,
              "oct": 0,
              "dur": 0.5
            },
            {
              "deg": 5,
              "oct": 0,
              "dur": 0.5
            },
            {
              "deg": 4,
              "oct": 0,
              "dur": 0.5
            },
            {
              "deg": 3,
              "oct": 0,
              "dur": 1
            },
            {
              "deg": 1,
              "oct": 0,
              "dur": 1
            }
          ]
        },
        {
          "lyric": "ding, dang, dong; ding, dang, dong.",
          "notes": [
            {
              "deg": 1,
              "oct": 0,
              "dur": 1
            },
            {
              "deg": 5,
              "oct": -1,
              "dur": 1
            },
            {
              "deg": 1,
              "oct": 0,
              "dur": 2
            },
            {
              "deg": 1,
              "oct": 0,
              "dur": 1
            },
            {
              "deg": 5,
              "oct": -1,
              "dur": 1
            },
            {
              "deg": 1,
              "oct": 0,
              "dur": 2
            }
          ]
        }
      ]
    }
  },
  "arrangerNotes": "Verified against the Wikipedia LilyPond score (all four phrases of the round). No accidentals. Ending 'ding dang dong' uses low 5 (dot below), so minLayout 11 on both drums. C and D arrangements use identical degree sequences (both fit their drums).",
  "verified": true
}
