{
  "schemaVersion": 1,
  "id": "i-saw-three-ships",
  "title": "I Saw Three Ships",
  "artist": "Traditional (English)",
  "source": {
    "name": "Wikipedia (en) – I Saw Three Ships, LilyPond score",
    "url": "https://en.wikipedia.org/wiki/I_Saw_Three_Ships"
  },
  "license": "public-domain",
  "attribution": "Traditional English carol (17th century). Public domain. Arrangement: Tongue Drum Song Finder.",
  "difficulty": "easy",
  "tags": [
    "holiday",
    "christmas",
    "folk"
  ],
  "tempo": 110,
  "timeSignature": "6/8",
  "arrangements": {
    "C": {
      "minLayout": "11",
      "lines": [
        {
          "lyric": "I saw three ships come sailing in",
          "notes": [
            {
              "deg": 5,
              "oct": -1,
              "dur": 0.5
            },
            {
              "deg": 1,
              "oct": 0,
              "dur": 1
            },
            {
              "deg": 1,
              "oct": 0,
              "dur": 0.5
            },
            {
              "deg": 2,
              "oct": 0,
              "dur": 1
            },
            {
              "deg": 3,
              "oct": 0,
              "dur": 0.5
            },
            {
              "deg": 5,
              "oct": 0,
              "dur": 1
            },
            {
              "deg": 3,
              "oct": 0,
              "dur": 0.5
            },
            {
              "deg": 2,
              "oct": 0,
              "dur": 1
            }
          ]
        },
        {
          "lyric": "on Christmas day, on Christmas day;",
          "notes": [
            {
              "deg": 4,
              "oct": 0,
              "dur": 0.5
            },
            {
              "deg": 3,
              "oct": 0,
              "dur": 1
            },
            {
              "deg": 1,
              "oct": 0,
              "dur": 0.5
            },
            {
              "deg": 1,
              "oct": 0,
              "dur": 1
            },
            {
              "deg": 3,
              "oct": 0,
              "dur": 0.5
            },
            {
              "deg": 2,
              "oct": 0,
              "dur": 1
            },
            {
              "deg": 7,
              "oct": -1,
              "dur": 0.5
            },
            {
              "deg": 5,
              "oct": -1,
              "dur": 1
            }
          ]
        },
        {
          "lyric": "I saw three ships come sailing in",
          "notes": [
            {
              "deg": 5,
              "oct": -1,
              "dur": 0.5
            },
            {
              "deg": 1,
              "oct": 0,
              "dur": 1
            },
            {
              "deg": 1,
              "oct": 0,
              "dur": 0.5
            },
            {
              "deg": 2,
              "oct": 0,
              "dur": 1
            },
            {
              "deg": 3,
              "oct": 0,
              "dur": 0.5
            },
            {
              "deg": 5,
              "oct": 0,
              "dur": 1
            },
            {
              "deg": 3,
              "oct": 0,
              "dur": 0.5
            },
            {
              "deg": 2,
              "oct": 0,
              "dur": 1
            }
          ]
        },
        {
          "lyric": "on Christmas day in the morning.",
          "notes": [
            {
              "deg": 4,
              "oct": 0,
              "dur": 0.5
            },
            {
              "deg": 3,
              "oct": 0,
              "dur": 1
            },
            {
              "deg": 1,
              "oct": 0,
              "dur": 0.5
            },
            {
              "deg": 1,
              "oct": 0,
              "dur": 0.5
            },
            {
              "deg": 2,
              "oct": 0,
              "dur": 0.5
            },
            {
              "deg": 3,
              "oct": 0,
              "dur": 0.5
            },
            {
              "deg": 2,
              "oct": 0,
              "dur": 1.5
            },
            {
              "deg": 1,
              "oct": 0,
              "dur": 1
            }
          ]
        }
      ]
    },
    "D": {
      "minLayout": "11",
      "lines": [
        {
          "lyric": "I saw three ships come sailing in",
          "notes": [
            {
              "deg": 5,
              "oct": -1,
              "dur": 0.5
            },
            {
              "deg": 1,
              "oct": 0,
              "dur": 1
            },
            {
              "deg": 1,
              "oct": 0,
              "dur": 0.5
            },
            {
              "deg": 2,
              "oct": 0,
              "dur": 1
            },
            {
              "deg": 3,
              "oct": 0,
              "dur": 0.5
            },
            {
              "deg": 5,
              "oct": 0,
              "dur": 1
            },
            {
              "deg": 3,
              "oct": 0,
              "dur": 0.5
            },
            {
              "deg": 2,
              "oct": 0,
              "dur": 1
            }
          ]
        },
        {
          "lyric": "on Christmas day, on Christmas day;",
          "notes": [
            {
              "deg": 4,
              "oct": 0,
              "dur": 0.5
            },
            {
              "deg": 3,
              "oct": 0,
              "dur": 1
            },
            {
              "deg": 1,
              "oct": 0,
              "dur": 0.5
            },
            {
              "deg": 1,
              "oct": 0,
              "dur": 1
            },
            {
              "deg": 3,
              "oct": 0,
              "dur": 0.5
            },
            {
              "deg": 2,
              "oct": 0,
              "dur": 1
            },
            {
              "deg": 7,
              "oct": -1,
              "dur": 0.5
            },
            {
              "deg": 5,
              "oct": -1,
              "dur": 1
            }
          ]
        },
        {
          "lyric": "I saw three ships come sailing in",
          "notes": [
            {
              "deg": 5,
              "oct": -1,
              "dur": 0.5
            },
            {
              "deg": 1,
              "oct": 0,
              "dur": 1
            },
            {
              "deg": 1,
              "oct": 0,
              "dur": 0.5
            },
            {
              "deg": 2,
              "oct": 0,
              "dur": 1
            },
            {
              "deg": 3,
              "oct": 0,
              "dur": 0.5
            },
            {
              "deg": 5,
              "oct": 0,
              "dur": 1
            },
            {
              "deg": 3,
              "oct": 0,
              "dur": 0.5
            },
            {
              "deg": 2,
              "oct": 0,
              "dur": 1
            }
          ]
        },
        {
          "lyric": "on Christmas day in the morning.",
          "notes": [
            {
              "deg": 4,
              "oct": 0,
              "dur": 0.5
            },
            {
              "deg": 3,
              "oct": 0,
              "dur": 1
            },
            {
              "deg": 1,
              "oct": 0,
              "dur": 0.5
            },
            {
              "deg": 1,
              "oct": 0,
              "dur": 0.5
            },
            {
              "deg": 2,
              "oct": 0,
              "dur": 0.5
            },
            {
              "deg": 3,
              "oct": 0,
              "dur": 0.5
            },
            {
              "deg": 2,
              "oct": 0,
              "dur": 1.5
            },
            {
              "deg": 1,
              "oct": 0,
              "dur": 1
            }
          ]
        }
      ]
    }
  },
  "arrangerNotes": "6/8 time (eighth = 0.5 beat). Verified against the LilyPond score on English Wikipedia; the repeat with first and second endings is written out. No simplification needed. Range low 5 to 5. C and D arrangements use identical degree sequences (both fit their drums).",
  "verified": true
}
