{
  "schemaVersion": 1,
  "id": "une-poule-sur-un-mur",
  "title": "Une poule sur un mur",
  "artist": "Traditional (French)",
  "source": {
    "name": "Wikipedia (fr) – Une poule sur un mur, LilyPond score",
    "url": "https://fr.wikipedia.org/wiki/Une_poule_sur_un_mur_%28chanson%29"
  },
  "license": "public-domain",
  "attribution": "Traditional French children's rhyme. Public domain. Arrangement: Tongue Drum Song Finder.",
  "difficulty": "easy",
  "tags": [
    "kids",
    "nursery",
    "french"
  ],
  "tempo": 108,
  "timeSignature": "2/4",
  "arrangements": {
    "C": {
      "minLayout": "11",
      "lines": [
        {
          "lyric": "Une poule sur un mur",
          "notes": [
            {
              "deg": 1,
              "oct": 0,
              "dur": 0.5
            },
            {
              "deg": 1,
              "oct": 0,
              "dur": 0.5
            },
            {
              "deg": 1,
              "oct": 0,
              "dur": 0.5
            },
            {
              "deg": 1,
              "oct": 0,
              "dur": 0.5
            },
            {
              "deg": 2,
              "oct": 0,
              "dur": 0.5
            },
            {
              "deg": 2,
              "oct": 0,
              "dur": 0.5
            },
            {
              "deg": 5,
              "oct": -1,
              "dur": 1
            }
          ]
        },
        {
          "lyric": "qui picotait du pain dur,",
          "notes": [
            {
              "deg": 1,
              "oct": 0,
              "dur": 0.5
            },
            {
              "deg": 1,
              "oct": 0,
              "dur": 0.5
            },
            {
              "deg": 1,
              "oct": 0,
              "dur": 0.5
            },
            {
              "deg": 1,
              "oct": 0,
              "dur": 0.5
            },
            {
              "deg": 2,
              "oct": 0,
              "dur": 0.5
            },
            {
              "deg": 2,
              "oct": 0,
              "dur": 0.5
            },
            {
              "deg": 5,
              "oct": -1,
              "dur": 1
            }
          ]
        },
        {
          "lyric": "picoti, picota,",
          "notes": [
            {
              "deg": 1,
              "oct": 0,
              "dur": 0.5
            },
            {
              "deg": 1,
              "oct": 0,
              "dur": 0.5
            },
            {
              "deg": 1,
              "oct": 0,
              "dur": 1
            },
            {
              "deg": 1,
              "oct": 0,
              "dur": 0.5
            },
            {
              "deg": 1,
              "oct": 0,
              "dur": 0.5
            },
            {
              "deg": 2,
              "oct": 0,
              "dur": 1
            }
          ]
        },
        {
          "lyric": "lève la queue et puis s'en va!",
          "notes": [
            {
              "deg": 1,
              "oct": 0,
              "dur": 0.5
            },
            {
              "deg": 1,
              "oct": 0,
              "dur": 0.5
            },
            {
              "deg": 2,
              "oct": 0,
              "dur": 0.5
            },
            {
              "deg": 1,
              "oct": 0,
              "dur": 0.5
            },
            {
              "deg": 2,
              "oct": 0,
              "dur": 0.5
            },
            {
              "deg": 5,
              "oct": 0,
              "dur": 0.5
            },
            {
              "deg": 1,
              "oct": 0,
              "dur": 1
            }
          ]
        }
      ]
    },
    "D": {
      "minLayout": "11",
      "lines": [
        {
          "lyric": "Une poule sur un mur",
          "notes": [
            {
              "deg": 1,
              "oct": 0,
              "dur": 0.5
            },
            {
              "deg": 1,
              "oct": 0,
              "dur": 0.5
            },
            {
              "deg": 1,
              "oct": 0,
              "dur": 0.5
            },
            {
              "deg": 1,
              "oct": 0,
              "dur": 0.5
            },
            {
              "deg": 2,
              "oct": 0,
              "dur": 0.5
            },
            {
              "deg": 2,
              "oct": 0,
              "dur": 0.5
            },
            {
              "deg": 5,
              "oct": -1,
              "dur": 1
            }
          ]
        },
        {
          "lyric": "qui picotait du pain dur,",
          "notes": [
            {
              "deg": 1,
              "oct": 0,
              "dur": 0.5
            },
            {
              "deg": 1,
              "oct": 0,
              "dur": 0.5
            },
            {
              "deg": 1,
              "oct": 0,
              "dur": 0.5
            },
            {
              "deg": 1,
              "oct": 0,
              "dur": 0.5
            },
            {
              "deg": 2,
              "oct": 0,
              "dur": 0.5
            },
            {
              "deg": 2,
              "oct": 0,
              "dur": 0.5
            },
            {
              "deg": 5,
              "oct": -1,
              "dur": 1
            }
          ]
        },
        {
          "lyric": "picoti, picota,",
          "notes": [
            {
              "deg": 1,
              "oct": 0,
              "dur": 0.5
            },
            {
              "deg": 1,
              "oct": 0,
              "dur": 0.5
            },
            {
              "deg": 1,
              "oct": 0,
              "dur": 1
            },
            {
              "deg": 1,
              "oct": 0,
              "dur": 0.5
            },
            {
              "deg": 1,
              "oct": 0,
              "dur": 0.5
            },
            {
              "deg": 2,
              "oct": 0,
              "dur": 1
            }
          ]
        },
        {
          "lyric": "lève la queue et puis s'en va!",
          "notes": [
            {
              "deg": 1,
              "oct": 0,
              "dur": 0.5
            },
            {
              "deg": 1,
              "oct": 0,
              "dur": 0.5
            },
            {
              "deg": 2,
              "oct": 0,
              "dur": 0.5
            },
            {
              "deg": 1,
              "oct": 0,
              "dur": 0.5
            },
            {
              "deg": 2,
              "oct": 0,
              "dur": 0.5
            },
            {
              "deg": 5,
              "oct": 0,
              "dur": 0.5
            },
            {
              "deg": 1,
              "oct": 0,
              "dur": 1
            }
          ]
        }
      ]
    }
  },
  "arrangerNotes": "Verified against the LilyPond score on French Wikipedia (the final fermata is not held). No simplification needed. Range low 5 to 5. C and D arrangements use identical degree sequences (both fit their drums).",
  "verified": true
}
