{
  "schemaVersion": 1,
  "id": "rain-rain-go-away",
  "title": "Rain, Rain, Go Away",
  "artist": "Traditional",
  "source": {
    "name": "Wikipedia (en) – Rain Rain Go Away, LilyPond score",
    "url": "https://en.wikipedia.org/wiki/Rain_Rain_Go_Away"
  },
  "license": "public-domain",
  "attribution": "Traditional nursery rhyme (words 17th century) and children's chant tune. Public domain. Arrangement: Tongue Drum Song Finder.",
  "difficulty": "easy",
  "tags": [
    "kids",
    "nursery"
  ],
  "tempo": 100,
  "timeSignature": "4/4",
  "arrangements": {
    "C": {
      "minLayout": "8",
      "lines": [
        {
          "lyric": "Rain, rain, go away,",
          "notes": [
            {
              "deg": 5,
              "oct": 0,
              "dur": 1
            },
            {
              "deg": 3,
              "oct": 0,
              "dur": 1
            },
            {
              "deg": 5,
              "oct": 0,
              "dur": 0.5
            },
            {
              "deg": 5,
              "oct": 0,
              "dur": 0.5
            },
            {
              "deg": 3,
              "oct": 0,
              "dur": 1
            }
          ]
        },
        {
          "lyric": "come again another day,",
          "notes": [
            {
              "deg": 5,
              "oct": 0,
              "dur": 0.5
            },
            {
              "deg": 5,
              "oct": 0,
              "dur": 0.5
            },
            {
              "deg": 3,
              "oct": 0,
              "dur": 0.5
            },
            {
              "deg": 6,
              "oct": 0,
              "dur": 0.5
            },
            {
              "deg": 5,
              "oct": 0,
              "dur": 0.5
            },
            {
              "deg": 5,
              "oct": 0,
              "dur": 0.5
            },
            {
              "deg": 3,
              "oct": 0,
              "dur": 1
            }
          ]
        },
        {
          "lyric": "little Arthur wants to play,",
          "notes": [
            {
              "deg": 4,
              "oct": 0,
              "dur": 0.5
            },
            {
              "deg": 4,
              "oct": 0,
              "dur": 0.5
            },
            {
              "deg": 2,
              "oct": 0,
              "dur": 0.5
            },
            {
              "deg": 2,
              "oct": 0,
              "dur": 0.5
            },
            {
              "deg": 4,
              "oct": 0,
              "dur": 0.5
            },
            {
              "deg": 4,
              "oct": 0,
              "dur": 0.5
            },
            {
              "deg": 2,
              "oct": 0,
              "dur": 1
            }
          ]
        },
        {
          "lyric": "rain, rain, go away.",
          "notes": [
            {
              "deg": 5,
              "oct": 0,
              "dur": 0.5
            },
            {
              "deg": 4,
              "oct": 0,
              "dur": 0.5
            },
            {
              "deg": 3,
              "oct": 0,
              "dur": 0.5
            },
            {
              "deg": 2,
              "oct": 0,
              "dur": 0.5
            },
            {
              "deg": 3,
              "oct": 0,
              "dur": 0.5
            },
            {
              "deg": 1,
              "oct": 0,
              "dur": 0.5
            },
            {
              "deg": 1,
              "oct": 0,
              "dur": 1
            }
          ]
        }
      ]
    },
    "D": {
      "minLayout": "8",
      "lines": [
        {
          "lyric": "Rain, rain, go away,",
          "notes": [
            {
              "deg": 5,
              "oct": 0,
              "dur": 1
            },
            {
              "deg": 3,
              "oct": 0,
              "dur": 1
            },
            {
              "deg": 5,
              "oct": 0,
              "dur": 0.5
            },
            {
              "deg": 5,
              "oct": 0,
              "dur": 0.5
            },
            {
              "deg": 3,
              "oct": 0,
              "dur": 1
            }
          ]
        },
        {
          "lyric": "come again another day,",
          "notes": [
            {
              "deg": 5,
              "oct": 0,
              "dur": 0.5
            },
            {
              "deg": 5,
              "oct": 0,
              "dur": 0.5
            },
            {
              "deg": 3,
              "oct": 0,
              "dur": 0.5
            },
            {
              "deg": 6,
              "oct": 0,
              "dur": 0.5
            },
            {
              "deg": 5,
              "oct": 0,
              "dur": 0.5
            },
            {
              "deg": 5,
              "oct": 0,
              "dur": 0.5
            },
            {
              "deg": 3,
              "oct": 0,
              "dur": 1
            }
          ]
        },
        {
          "lyric": "little Arthur wants to play,",
          "notes": [
            {
              "deg": 4,
              "oct": 0,
              "dur": 0.5
            },
            {
              "deg": 4,
              "oct": 0,
              "dur": 0.5
            },
            {
              "deg": 2,
              "oct": 0,
              "dur": 0.5
            },
            {
              "deg": 2,
              "oct": 0,
              "dur": 0.5
            },
            {
              "deg": 4,
              "oct": 0,
              "dur": 0.5
            },
            {
              "deg": 4,
              "oct": 0,
              "dur": 0.5
            },
            {
              "deg": 2,
              "oct": 0,
              "dur": 1
            }
          ]
        },
        {
          "lyric": "rain, rain, go away.",
          "notes": [
            {
              "deg": 5,
              "oct": 0,
              "dur": 0.5
            },
            {
              "deg": 4,
              "oct": 0,
              "dur": 0.5
            },
            {
              "deg": 3,
              "oct": 0,
              "dur": 0.5
            },
            {
              "deg": 2,
              "oct": 0,
              "dur": 0.5
            },
            {
              "deg": 3,
              "oct": 0,
              "dur": 0.5
            },
            {
              "deg": 1,
              "oct": 0,
              "dur": 0.5
            },
            {
              "deg": 1,
              "oct": 0,
              "dur": 1
            }
          ]
        }
      ]
    }
  },
  "arrangerNotes": "Verified against the LilyPond score on English Wikipedia. Slurred notes carry one syllable over two notes. No simplification needed. Range 1 to 6. C and D arrangements use identical degree sequences (both fit their drums).",
  "verified": true
}
