{
  "schemaVersion": 1,
  "id": "red-river-valley",
  "title": "Red River Valley",
  "artist": "Traditional",
  "source": {
    "name": "Wikipedia (en) – Red River Valley, LilyPond score",
    "url": "https://en.wikipedia.org/wiki/Red_River_Valley_(song)"
  },
  "license": "public-domain",
  "attribution": "Traditional North American folk song (published 1896; older oral versions). Public domain. Arrangement: Tongue Drum Song Finder.",
  "difficulty": "easy",
  "tags": [
    "folk",
    "american",
    "cowboy"
  ],
  "tempo": 90,
  "timeSignature": "4/4",
  "arrangements": {
    "C": {
      "minLayout": "11",
      "lines": [
        {
          "lyric": "From this valley they say you are going,",
          "notes": [
            {
              "deg": 5,
              "oct": -1,
              "dur": 0.5
            },
            {
              "deg": 1,
              "oct": 0,
              "dur": 0.5
            },
            {
              "deg": 3,
              "oct": 0,
              "dur": 1
            },
            {
              "deg": 3,
              "oct": 0,
              "dur": 0.5
            },
            {
              "deg": 3,
              "oct": 0,
              "dur": 0.5
            },
            {
              "deg": 3,
              "oct": 0,
              "dur": 1
            },
            {
              "deg": 2,
              "oct": 0,
              "dur": 0.5
            },
            {
              "deg": 3,
              "oct": 0,
              "dur": 0.5
            },
            {
              "deg": 2,
              "oct": 0,
              "dur": 1
            },
            {
              "deg": 1,
              "oct": 0,
              "dur": 2
            }
          ]
        },
        {
          "lyric": "we will miss your bright eyes and sweet smile,",
          "notes": [
            {
              "deg": 3,
              "oct": 0,
              "dur": 0.5
            },
            {
              "deg": 3,
              "oct": 0,
              "dur": 0.5
            },
            {
              "deg": 3,
              "oct": 0,
              "dur": 1
            },
            {
              "deg": 1,
              "oct": 0,
              "dur": 0.5
            },
            {
              "deg": 3,
              "oct": 0,
              "dur": 0.5
            },
            {
              "deg": 5,
              "oct": 0,
              "dur": 1
            },
            {
              "deg": 4,
              "oct": 0,
              "dur": 0.5
            },
            {
              "deg": 3,
              "oct": 0,
              "dur": 0.5
            },
            {
              "deg": 2,
              "oct": 0,
              "dur": 3
            }
          ]
        },
        {
          "lyric": "for they say you are taking the sunshine",
          "notes": [
            {
              "deg": 5,
              "oct": 0,
              "dur": 0.5
            },
            {
              "deg": 4,
              "oct": 0,
              "dur": 0.5
            },
            {
              "deg": 3,
              "oct": 0,
              "dur": 1
            },
            {
              "deg": 3,
              "oct": 0,
              "dur": 0.5
            },
            {
              "deg": 2,
              "oct": 0,
              "dur": 0.5
            },
            {
              "deg": 1,
              "oct": 0,
              "dur": 1
            },
            {
              "deg": 2,
              "oct": 0,
              "dur": 0.5
            },
            {
              "deg": 3,
              "oct": 0,
              "dur": 0.5
            },
            {
              "deg": 5,
              "oct": 0,
              "dur": 1
            },
            {
              "deg": 4,
              "oct": 0,
              "dur": 2
            }
          ]
        },
        {
          "lyric": "that has brightened our pathway a while.",
          "notes": [
            {
              "deg": 6,
              "oct": -1,
              "dur": 0.5
            },
            {
              "deg": 6,
              "oct": -1,
              "dur": 0.5
            },
            {
              "deg": 5,
              "oct": -1,
              "dur": 1
            },
            {
              "deg": 7,
              "oct": -1,
              "dur": 0.5
            },
            {
              "deg": 1,
              "oct": 0,
              "dur": 0.5
            },
            {
              "deg": 2,
              "oct": 0,
              "dur": 1
            },
            {
              "deg": 3,
              "oct": 0,
              "dur": 0.5
            },
            {
              "deg": 2,
              "oct": 0,
              "dur": 0.5
            },
            {
              "deg": 1,
              "oct": 0,
              "dur": 4
            }
          ]
        }
      ]
    },
    "D": {
      "minLayout": "11",
      "lines": [
        {
          "lyric": "From this valley they say you are going,",
          "notes": [
            {
              "deg": 5,
              "oct": -1,
              "dur": 0.5
            },
            {
              "deg": 1,
              "oct": 0,
              "dur": 0.5
            },
            {
              "deg": 3,
              "oct": 0,
              "dur": 1
            },
            {
              "deg": 3,
              "oct": 0,
              "dur": 0.5
            },
            {
              "deg": 3,
              "oct": 0,
              "dur": 0.5
            },
            {
              "deg": 3,
              "oct": 0,
              "dur": 1
            },
            {
              "deg": 2,
              "oct": 0,
              "dur": 0.5
            },
            {
              "deg": 3,
              "oct": 0,
              "dur": 0.5
            },
            {
              "deg": 2,
              "oct": 0,
              "dur": 1
            },
            {
              "deg": 1,
              "oct": 0,
              "dur": 2
            }
          ]
        },
        {
          "lyric": "we will miss your bright eyes and sweet smile,",
          "notes": [
            {
              "deg": 3,
              "oct": 0,
              "dur": 0.5
            },
            {
              "deg": 3,
              "oct": 0,
              "dur": 0.5
            },
            {
              "deg": 3,
              "oct": 0,
              "dur": 1
            },
            {
              "deg": 1,
              "oct": 0,
              "dur": 0.5
            },
            {
              "deg": 3,
              "oct": 0,
              "dur": 0.5
            },
            {
              "deg": 5,
              "oct": 0,
              "dur": 1
            },
            {
              "deg": 4,
              "oct": 0,
              "dur": 0.5
            },
            {
              "deg": 3,
              "oct": 0,
              "dur": 0.5
            },
            {
              "deg": 2,
              "oct": 0,
              "dur": 3
            }
          ]
        },
        {
          "lyric": "for they say you are taking the sunshine",
          "notes": [
            {
              "deg": 5,
              "oct": 0,
              "dur": 0.5
            },
            {
              "deg": 4,
              "oct": 0,
              "dur": 0.5
            },
            {
              "deg": 3,
              "oct": 0,
              "dur": 1
            },
            {
              "deg": 3,
              "oct": 0,
              "dur": 0.5
            },
            {
              "deg": 2,
              "oct": 0,
              "dur": 0.5
            },
            {
              "deg": 1,
              "oct": 0,
              "dur": 1
            },
            {
              "deg": 2,
              "oct": 0,
              "dur": 0.5
            },
            {
              "deg": 3,
              "oct": 0,
              "dur": 0.5
            },
            {
              "deg": 5,
              "oct": 0,
              "dur": 1
            },
            {
              "deg": 4,
              "oct": 0,
              "dur": 2
            }
          ]
        },
        {
          "lyric": "that has brightened our pathway a while.",
          "notes": [
            {
              "deg": 6,
              "oct": -1,
              "dur": 0.5
            },
            {
              "deg": 6,
              "oct": -1,
              "dur": 0.5
            },
            {
              "deg": 5,
              "oct": -1,
              "dur": 1
            },
            {
              "deg": 7,
              "oct": -1,
              "dur": 0.5
            },
            {
              "deg": 1,
              "oct": 0,
              "dur": 0.5
            },
            {
              "deg": 2,
              "oct": 0,
              "dur": 1
            },
            {
              "deg": 3,
              "oct": 0,
              "dur": 0.5
            },
            {
              "deg": 2,
              "oct": 0,
              "dur": 0.5
            },
            {
              "deg": 1,
              "oct": 0,
              "dur": 4
            }
          ]
        }
      ]
    }
  },
  "arrangerNotes": "Verified against the Wikipedia LilyPond score (verse; the chorus 'Come and sit by my side' uses the same tune). No accidentals. Range low 5 to 5, minLayout 11 on both drums. C and D arrangements use identical degree sequences (both fit their drums).",
  "verified": true
}
